{
  "name": "Horts",
  "address": "49 Broad St, Bristol",
  "postcode": "BS1 2EP",
  "website-url": "http://www.hortsbristol.com",
  "maps-url": "https://www.google.co.uk/maps/place/Horts/@51.4554877,-2.5960549,17z/data=!3m1!4b1!4m5!3m4!1s0x48718e7791fd35eb:0x912174706bcf4525!8m2!3d51.4554877!4d-2.5938662?hl=en"
}
