{
  "name": "Brightpearl",
  "address": "New Bond House, Bond Street, Bristol BS2 9AG, UK",
  "postcode": "BS2 9AG",
  "website-url": "https://www.brightpearl.com/",
  "maps-url": "https://www.google.com/maps/place/Brightpearl/@51.4598061,-2.5864296,17z/data=!3m1!4b1!4m5!3m4!1s0x48718e71f99fca99:0xa006f70b6f44cbd3!8m2!3d51.4598061!4d-2.5842409?hl=en"
}
