{
  "name": "DeskLodge",
  "address": "1 Temple Way, Bristol BS2 0BY, UK",
  "postcode": "BS2 0BY",
  "website-url": "https://desklodge.com/",
  "maps-url": "https://www.google.com/maps/place/DeskLodge/@51.4548311,-2.5850307,17z/data=!3m1!4b1!4m5!3m4!1s0x48761b40aba643fb:0xbca2fa66dbdb1d5b!8m2!3d51.4548311!4d-2.582842?hl=en"
}