{
  "name": "Volunteer Tavern",
  "address": "9 New St, Near Cabot Circus, Bristol",
  "postcode": "BS2 9DX",
  "website-url": "http://volunteertavern.co.uk/",
  "maps-url": "https://www.google.co.uk/maps/place/Volunteer+Tavern/@51.4576774,-2.5842452,17z/data=!3m1!4b1!4m5!3m4!1s0x48718e6fb529ad6f:0xd6b9ce794b9c0273!8m2!3d51.4576741!4d-2.5820565"
}