{
  "name": "MixRadio",
  "address": "Prudential Buildings, 11-19 Wine St, Bristol",
  "postcode": "BS1 2PH",
  "website-url": "http://www.mixradiomusic.com",
  "maps-url": "https://www.google.com/maps/place/The+Prudential+Buildings/@51.4553799,-2.5945477,17z/data=!4m8!1m2!2m1!1sPrudential+Buildings,+11-19+Wine+St.,+Bristol,+BS1+2PH,+Bristol,+Bristol,+gb!3m4!1s0x48718e7742bdbdd9:0xc765bd29f2f938db!8m2!3d51.4553157!4d-2.5923703?hl=en"
}
