{
  "name": "The Bristol Ram",
  "address": "32 Park St, West End, Bristol",
  "postcode": "BS1 5JA",
  "website-url": "http://www.thebristolram.co.uk",
  "maps-url": "https://www.google.co.uk/maps/place/The+Bristol+Ram/@51.4540211,-2.6041633,17z/data=!3m1!4b1!4m5!3m4!1s0x48718dd0ad58c6e9:0x90c98c3f76775b5e!8m2!3d51.4540211!4d-2.6019746?hl=en"
}
