{
  "name": "The Famous Royal Navy Volunteer",
  "address": "17-18 King Street, Old City, Bristol",
  "postcode": "BS1 4EF",
  "website-url": "http://navyvolunteer.co.uk",
  "maps-url": "https://www.google.co.uk/maps/place/The+Famous+Royal+Navy+Volunteer/@51.4517519,-2.5967742,17z/data=!3m1!4b1!4m5!3m4!1s0x48718e788e56b41f:0x86dcd201a5ea99b8!8m2!3d51.4517519!4d-2.5945855?hl=en"
}
