{
  "name": "BaseKit",
  "address": "5th Floor One Castle Park, Tower Hill, Bristol BS2 0JA, UK",
  "postcode": "BS2 0JA",
  "website-url": "https://www.basekit.com/",
  "maps-url": "https://www.google.com/maps/place/BaseKit/@51.4553045,-2.5869773,17z/data=!3m1!4b1!4m5!3m4!1s0x48718e7771c6e43b:0x57389bdc2634249e!8m2!3d51.4553045!4d-2.5847886?hl=en"
}