{
  "name": "BaseKit Office",
  "address": "4th Floor, The Pithay",
  "postcode": "BS1 2ND",
  "website-url": "https://www.basekit.com/",
  "maps-url": "https://www.google.co.uk/maps/place/Pithay,+Bristol+BS1+3BN/@51.455749,-2.5942937,17z/data=!3m1!4b1!4m5!3m4!1s0x48718e7771d6d179:0x81663ca0dd2a2109!8m2!3d51.4557591!4d-2.5920657?hl=en"
}
