{
  "name": "King William Ale House",
  "address": "20 King St, Bristol",
  "postcode": "BS1 4EF",
  "website-url": "",
  "maps-url": "https://www.google.co.uk/maps/place/King+William+Ale+House/@51.4511729,-2.5712227,13z/data=!4m8!1m2!2m1!1sThe+King+William+Bristol!3m4!1s0x48718e7885a88e91:0x9294bb860628f830!8m2!3d51.4516718!4d-2.5948646?hl=en"
}
