{
  "name": "The Golden Guinea",
  "address": "19 Guinea St, Bristol",
  "postcode": "BS1 6SX",
  "website-url": "http://thegoldenguinea.co.uk",
  "maps-url": "https://www.google.co.uk/maps/place/The+Golden+Guinea/@51.4475036,-2.5940756,14z/data=!4m12!1m6!3m5!1s0x48718e7f0f4fe145:0x60909a6b44aa3ebb!2sThe+Golden+Guinea!8m2!3d51.4473612!4d-2.5928274!3m4!1s0x48718e7f0f4fe145:0x60909a6b44aa3ebb!8m2!3d51.4473612!4d-2.5928274?hl=en"
}
