{
  "name": "Edo",
  "address": "The Quorum, Bond St, Bristol BS1 3AE, UK",
  "postcode": "BS1 3AE",
  "website-url": "https://www.edo.co/",
  "maps-url": "https://www.google.com/maps/place/Edo/@51.4561053,-2.5854633,17z/data=!3m1!4b1!4m5!3m4!1s0x48718e7848e61129:0x5c939da1cf9c07bb!8m2!3d51.4561053!4d-2.5832746?hl=en"
}