{
  "name": "Stag & Hounds",
  "address": "74 Old Market St, Bristol",
  "postcode": "BS2 0EJ",
  "website-url": "http://www.stagandhoundsbristol.co.uk",
  "maps-url": "https://www.google.com/maps/place/Stag+%26+Hounds/@51.4556425,-2.5846548,17z/data=!4m13!1m7!3m6!1s0x48718e6ff1a744fb:0x332866577b3501fb!2sStag+%26+Hounds,+74+Old+Market+St,+Bristol+BS2+0EJ!3b1!8m2!3d51.4556425!4d-2.5824661!3m4!1s0x48718e6ffa54a4fb:0x59ab2d0c988ec258!8m2!3d51.4556075!4d-2.5829274?hl=en"
}
