{
  "name": "Small Bar",
  "address": "31 King St, Bristol",
  "postcode": "BS1 4DZ",
  "website-url": "http://www.smallbar.co.uk",
  "maps-url": "https://www.google.co.uk/maps/place/Small+Bar/@51.4518433,-2.5972218,17z/data=!3m1!4b1!4m5!3m4!1s0x48718e788440afcb:0x4d6c80ad935768c8!8m2!3d51.4518433!4d-2.5950331?hl=en"
}
